{
  "$schema": "https://json-schema.org/draft/2020-12/schema",
  "type": "object",
  "properties": {
    "schemaVersion": {
      "const": 1
    },
    "documentId": {
      "type": "string",
      "minLength": 1
    },
    "offset": {
      "type": "integer",
      "minimum": 0,
      "maximum": 4294967295
    },
    "hidden": {
      "type": "boolean"
    },
    "start": {
      "type": [
        "integer",
        "null"
      ],
      "minimum": 0
    },
    "end": {
      "type": [
        "integer",
        "null"
      ],
      "minimum": 0
    },
    "startLine": {
      "type": "integer",
      "minimum": 0,
      "maximum": 4294967295
    },
    "startColumn": {
      "type": "integer",
      "minimum": 0,
      "maximum": 4294967295
    },
    "endLine": {
      "type": "integer",
      "minimum": 0,
      "maximum": 4294967295
    },
    "endColumn": {
      "type": "integer",
      "minimum": 0,
      "maximum": 4294967295
    }
  },
  "required": [
    "schemaVersion",
    "documentId",
    "offset",
    "hidden",
    "start",
    "end",
    "startLine",
    "startColumn",
    "endLine",
    "endColumn"
  ],
  "additionalProperties": false
}
